{
  "id": "ai",
  "name": "AI Engine",
  "icon": "✨",
  "package": "com.ajit.dynamicisland.module.ai",
  "summary": "A small language model on your phone for notes, Catch me up and reply suggestions.",
  "developer": "Ajit Kumar Pal",
  "firstParty": true,
  "repo": "https://github.com/ajitpal/dynamic-island-android/tree/main/modules/ai",
  "download": "https://github.com/ajitpal/dynamic-island-android/releases/latest",
  "certSha256": "12178c6a653dd8e19c2414b0f4375270706820c14b0fc42bc5137c44d5416501",
  "permissions": [
    {
      "name": "android.permission.INTERNET",
      "reason": "Downloads a model once"
    },
    {
      "name": "android.permission.POST_NOTIFICATIONS",
      "reason": "Shows download progress"
    },
    {
      "name": "com.google.android.apps.aicore.service.BIND_SERVICE",
      "reason": "Uses Gemini Nano on phones that have it (off by default)"
    }
  ],
  "privacy": "Everything stays on the phone. See PRIVACY.md in the repository."
}
