{
  "id": "screen",
  "name": "Screen Recorder",
  "icon": "⏺️",
  "package": "com.ajit.dynamicisland.module.screen",
  "summary": "Record your screen from the island: countdown, REC timer with Pause and Stop, phone sound or mic, then Play or Share.",
  "developer": "Ajit Kumar Pal",
  "firstParty": true,
  "repo": "https://github.com/ajitpal/dynamic-island-android/tree/main/modules/screen",
  "download": "https://github.com/ajitpal/dynamic-island-android/releases/latest",
  "certSha256": "12178c6a653dd8e19c2414b0f4375270706820c14b0fc42bc5137c44d5416501",
  "permissions": [
    {
      "name": "android.permission.RECORD_AUDIO",
      "reason": "Only if you choose a sound option: records the microphone or the phone's own sound"
    },
    {
      "name": "android.permission.POST_NOTIFICATIONS",
      "reason": "Shows the recording notification Android requires, with Pause and Stop"
    }
  ],
  "privacy": "Videos are saved on your phone (Movies › Dynamic Island) and never uploaded. The module has no internet permission."
}
