{
  "id": "updater",
  "name": "Updater",
  "icon": "⬇️",
  "package": "com.ajit.dynamicisland.module.updater",
  "summary": "Keeps the island and your modules up to date from GitHub.",
  "developer": "Ajit Kumar Pal",
  "firstParty": true,
  "repo": "https://github.com/ajitpal/dynamic-island-android/tree/main/modules/updater",
  "download": "https://github.com/ajitpal/dynamic-island-android/releases/latest",
  "certSha256": "12178c6a653dd8e19c2414b0f4375270706820c14b0fc42bc5137c44d5416501",
  "permissions": [
    {"name": "android.permission.INTERNET", "reason": "Reads which versions exist on GitHub, downloads the updates you choose, and fetches the signed module list from the project website"},
    {"name": "android.permission.REQUEST_INSTALL_PACKAGES", "reason": "Installs updates you confirm; Android asks you each time"},
    {"name": "android.permission.POST_NOTIFICATIONS", "reason": "Tells you once when a new version is out"}
  ],
  "privacy": "Only asks GitHub which versions exist, downloads the updates you tap, and reads the signed module list from the project website. Nothing about you or your phone is sent."
}
