{
  "id": "calendar",
  "name": "Calendar",
  "icon": "📅",
  "package": "com.ajit.dynamicisland.module.calendar",
  "summary": "Your next meeting in the island with one-tap Join.",
  "developer": "Ajit Kumar Pal",
  "firstParty": true,
  "repo": "https://github.com/ajitpal/dynamic-island-android/tree/main/modules/calendar",
  "download": "https://github.com/ajitpal/dynamic-island-android/releases/latest",
  "certSha256": "12178c6a653dd8e19c2414b0f4375270706820c14b0fc42bc5137c44d5416501",
  "permissions": [
    {
      "name": "android.permission.READ_CALENDAR",
      "reason": "Reads upcoming events on this phone"
    }
  ],
  "privacy": "Everything stays on the phone. See PRIVACY.md in the repository."
}
