{
  "id": "hello",
  "name": "Hello",
  "icon": "👋",
  "package": "com.example.islandmodule",
  "summary": "An example module: a tool, a card with buttons and a tile.",
  "developer": "Your name",
  "repo": "https://github.com/you/island-hello",
  "download": "https://github.com/you/island-hello/releases/latest",
  "apkUrl": "https://github.com/you/island-hello/releases/download/v1.0.0/island-hello-v1.0.0.apk",
  "version": "1.0.0",
  "certSha256": "0000000000000000000000000000000000000000000000000000000000000000",
  "permissions": [],
  "privacy": "Collects nothing and makes no network requests."
}
